Timestamp,Email Address,First Name,Last Name,"Primary Affiliation
(Academic Institution, Government Agency, etc.)","Site ID
(Provide a short, unique name using only letters and numbers. No spaces, underscores, or special characters. Example: harvbarn for the Harvard Forest Barn Tower)",Site Name Long,Is there co-located eddy covariance data? ,"EC Tower ID
This should match the EC site identifier from AmeriFlux or ICOS (e.g., US-Ha1).","EC Data Link
Paste a link to where the EC data can be downloaded (e.g., ICOS or AmeriFlux data portal).","Site Status
Select whether the site is currently collecting data. If inactive, enter the date the site stopped being operational.",Start Date,End Date,"Site Latitude
(Enter latitude in decimal degrees. Use negative values for the Southern Hemisphere.)","Site Longitude
(Enter longitude in decimal degrees. Use negative values for the Southern Hemisphere.)","Site Elevation
(Enter the site elevation in meters above sea level. This should be the elevation at the base of the tower, not the camera height.)","Plant Functional Type (PFT)
Select the dominant CLM Plant Functional Type (PFT) for this site. See CLM Technical Note, Table 2.2.1 for more detail.","Camera Brand & Model
Provide the full brand and model of the thermal instrument used (e.g., FLIR A655sc).","Pixel Resolution
Enter the native pixel resolution of the instrument by specifying the width and height in pixels (e.g., 640 Ã— 480).",Upload Single RGB Image of Site,"Upload Single Thermal Image of Site
Prefer .tif/.tiff (in Â°C)","Has this imagery data, in whole or in part, been previously published?",Are you interested in submitting thermal imagery for future ThermO Net open-access data portal?,Is there anything else you'd like us to know about your site?
4/24/26 12:07,miriam.johnston@umces.edu,Miriam,Johnston,University of Maryland Center for Environmental Science,US-Ton,Tonzi Ranch,Yes,US-Ton,https://ameriflux.lbl.gov/data/download-data/?dd=s,Inactive,7/18/18,9/1/20,38.4309,-120.966,177,Broadleaf deciduous tree Ð temperate,FLIR A325sc,320 x 240,https://drive.google.com/open?id=1pCiDZzM1TpWvSXRTVNh-JOmrMAPT_T3g,https://drive.google.com/open?id=173QUW5Z-IzWH3hB3klb5WVbUuQ6RYmo1,No,Yes,
4/25/26 3:07,etomelleri@unibz.it,Enrico,Tomelleri,Free University of Bozen-Bolzano,IT-Ren,,Yes,IT-Ren,https://data.icos-cp.eu/portal/#%7B%22filterCategories%22:%7B%22station%22:%5B%22iES_IT-Ren%22%5D%7D%7D,Active,2/3/25,,46.58686,11.43369,1744,Needleleaf evergreen tree Ð temperate,FLIR A700,640 x 480,https://drive.google.com/open?id=1b8J4MDJuIUL_ozPqLBXYNmOsBBEqUlh4,https://drive.google.com/open?id=1B6PagdjLNjMSlPA-Nakw-88uF0sc_Z5L,No,Not sure,
,andrew.richardson@nau.edu,Andrew,Richardson,,US-NR1,Niwot Ridge Forest (LTER NWT1),Yes,US-NR1,https://ameriflux.lbl.gov/sites/siteinfo/US-NR1,Inactive,2015,2021,40.0329,-105.5464,,Needleleaf evergreen tree Ð boreal,FLIR A655sc,640 x 480,,,,,
,jack.hastings@unh.edu,Jack,Hastings,,US-TFF,Thompson Farm Forest,Yes,US-TFF,Site Info for US-TFF- AmeriFlux (lbl.gov),Active,2024,,43.1084,-70.9523,,Broadleaf deciduous tree Ð temperate,FLIR A655sc,640 x 480,,,,,
,xw91@iu.edu,Xian,Wang,,US-MMS,Morgan Monroe State Forest,Yes,US-MMS,https://ameriflux.lbl.gov/sites/siteinfo/US-MMS,Active,2024,,39.3232,-86.4131,,Broadleaf deciduous tree Ð temperate,ICI 8640,,,,,,
,mark.irvine@inrae.fr,Mark,Irvine,,FR-Bil,Salles Pine Forest,Yes,FR-Bil,https://meta.icos-cp.eu/objects/OZBpt9-Th9sxPMwcuy5ZzFiq,Active,2020,,44.494244,0.955846,,Needleleaf evergreen tree Ð temperate,FLIR A655sc,640 x 480,,,,,
,jennifersusan.adams@uzh.ch,Jennifer,Adams,,CH-Lae,Laegern,Yes,CH-Lae,https://www.swissfluxnet.ethz.ch/index.php/sites/site-info-ch-lae/,Active,2024,,47.478333,8.364389,,Broadleaf deciduous tree Ð temperate,FLIR A700,,,,,,
,jennifersusan.adams@uzh.ch,Jennifer,Adams,,CH-Dav,Davos,Yes,CH-Dav,https://meta.icos-cp.eu/resources/stations/ES_CH-Dav,Active,2024,,46.815333,9.855972,,Needleleaf evergreen tree Ð boreal,FLIR A700,,,,,,
,andrew.richardson@nau.edu,Andrew,Richardson,,Harvard Forest,Harvard Forest (Barn Tower),Yes,,,Inactive,2013,2017,42.5353,-72.1899,,Broadleaf deciduous tree Ð temperate,FLIR A655sc,640 x 480,,,,,
,javadian@arizona.edu,Mostafa,Javadian,,US-Wkg,Walnut Gulch Kendall Grasslands,Yes,US-Wkg,https://ameriflux.lbl.gov/sites/siteinfo/US-Wkg,Active,2022,,31.7365,-109.9419,,"Broadleaf evergreen shrub Ð temperate, C4 grass",ICI 8640,,,,,,
,javadian@arizona.edu,Mostafa,Javadian,,US-MtB,Mt Bigelow,Yes,US-MtB,https://ameriflux.lbl.gov/sites/siteinfo/US-MtB,Active,2022,,32.416,-110.7256,,Needleleaf evergreen tree Ð temperate,ICI 8640,,,,,,
,w.woodgate@uq.edu.au,Will,Woodgate,,AU-Tum,Tumbarumba,Yes,AU-Tum,https://www.ozflux.org.au/monitoringsites/tumbarumba/tumba_description.html,Inactive,2016,2018,-35.6566,148.1517,,Broadleaf evergreen tree Ð tropical,FLIR A655sc,640 x 480,,,,,
,sophie.fauset@plymouth.ac.uk,Sophie,Fauset,,Bobiri Forest,,No,,,Active,2022,,6.691,-1.338,,Broadleaf deciduous tree Ð tropical,Fluke RSE 300,,,,,,
,sophie.fauset@plymouth.ac.uk,Sophie,Fauset,,BIFoR  FACE,,No,,,Active,2021,,52.801,-2.301,,Broadleaf deciduous tree Ð temperate,Fluke RSE 300,,,,,,
,chris.still@oregonstate.edu,Chris,Still,,US-Me2,Metolius,Yes,US-Me2,https://ameriflux.lbl.gov/sites/siteinfo/US-Me2,Active,,,44.4526,-121.5589,,Needleleaf evergreen tree Ð temperate,FLIR A325sc,320 x 240,,,,,
,chris.still@oregonstate.edu,Chris,Still,,US-Wrc,Wind River,Yes,US-Wrc,https://ameriflux.lbl.gov/sites/siteinfo/US-Wrc,Active,,,45.8205,-121.9519,,Needleleaf evergreen tree Ð temperate,FLIR A325sc,320 x 240,,,,,
,chris.still@oregonstate.edu,Chris,Still,,US-SCw,Pinyon Flat,Yes,US-SCw,https://ameriflux.lbl.gov/sites/siteinfo/US-SCw,Active,,,33.6047,-116.4527,,Broadleaf evergreen shrub Ð temperate,FLIR A325sc,320 x 240,,,,,
,chris.still@oregonstate.edu,Chris,Still,,PA-Bar,Barro Colorado Island,Yes,PA-Bar,https://ameriflux.lbl.gov/sites/siteinfo/PA-Bar,Inactive,,,9.1568,-79.8486,,Broadleaf evergreen tree Ð tropical,FLIR A325sc,320 x 240,,,,,
